[
  {
    "version": 1,
    "schemaRevision": "complaint-evaluation-v1",
    "recordId": "350588f1-ea38-4ff6-828f-f4b61cdf18e2",
    "receiptRevision": 4,
    "logicalSourceId": "f6c933138d615dd7c27b37feb21f5e769ee7b01e17c6541a18039788dce62c5c",
    "authorityNamespaceHash": "9d59c8799f4b60c7f7154c949a70c5d22118a45f801351a405d76927a19e808f",
    "admissionId": "350588f1-ea38-4ff6-828f-f4b61cdf18e2",
    "resultId": "04eb3872-5991-4ebb-942f-4fd99d0b0f52",
    "inputHash": "bfe4ccb10e93b6c5283834969d0fd5f069bddcc9f3a0f5a0149a5e3506415c0b",
    "sourceCertification": "certified",
    "sourceCertificationRevision": "telegram-original-v1",
    "policyId": "alert-watcher:default",
    "policyHash": "17ad92e63c962393c0329c658937d16eccaea13036412a3d1d0a5b6b8f29d738",
    "defaultPolicyHash": "17ad92e63c962393c0329c658937d16eccaea13036412a3d1d0a5b6b8f29d738",
    "policyRevision": "alert-classifier-v1",
    "policyMode": "default",
    "classifierSchemaRevision": "alert-classifier-v1",
    "enabled": true,
    "matched": true,
    "mode": "census",
    "eligibility": {
      "status": "bypass",
      "reason": "model_drift"
    },
    "requestedClassifierModel": {
      "provider": "anthropic",
      "model": "claude-haiku-4-5",
      "revision": "unqualified"
    },
    "resolvedClassifierModel": {
      "model": "claude-haiku-4-5",
      "provider": "anthropic",
      "revision": "unqualified"
    },
    "baseline": {
      "disposition": "negative",
      "severity": null,
      "attemptIds": ["04eb3872-5991-4ebb-942f-4fd99d0b0f52"]
    },
    "gate": null,
    "forwardedBaselineAttemptIds": ["04eb3872-5991-4ebb-942f-4fd99d0b0f52"],
    "suggestionAttemptIds": [],
    "attempts": [
      {
        "attemptId": "04eb3872-5991-4ebb-942f-4fd99d0b0f52",
        "purpose": "baseline",
        "disposition": "received",
        "requestedModel": {
          "model": "claude-haiku-4-5",
          "provider": "anthropic",
          "revision": "unqualified"
        },
        "resolvedModel": {
          "model": "claude-haiku-4-5",
          "provider": "anthropic",
          "revision": "unqualified"
        },
        "costStatus": "known",
        "costUsd": 0.0000348,
        "costCoverage": "complete",
        "usage": {
          "inputTokens": 12,
          "outputTokens": 4,
          "cacheReadTokens": 3,
          "cacheCreationTokens": 2
        },
        "elapsedMs": 1
      }
    ],
    "deadlineStatus": "within",
    "costCoverage": "complete",
    "elapsedMs": 1,
    "severityLabelRevision": null
  }
]
